type,name,description,display_order,notes
TESTIMONIAL,James Thompson,"My experience with HelixDoc surpassed all expectations. From the moment I stepped in, I was greeted with warmth and professionalism. The staff went above and beyond to accommodate my needs and ensure a smooth, hassle-free experience. Their expertise and attention to detail instilled confidence in me, knowing I was in capable hands. Thank you for your outstanding service!",1,"Tampa, Florida"
TESTIMONIAL,Emily Rodriguez,"I've had the privilege of being under the care of HelixDoc, and I must say, they've set a new standard for healthcare excellence. The seamless integration of cutting-edge technology with personalized care is truly commendable. From diagnosis to recovery, their holistic approach ensured I received comprehensive treatment tailored to my needs. Kudos to the entire team for their dedication to patient well-being!",2,"Riverview, Florida"
TESTIMONIAL,Samantha Wilson,"During a challenging health crisis, HelixDoc provided unwavering support and exceptional care. Their team of dedicated professionals not only treated my physical ailments but also offered emotional support, guiding me through every step of the journey. Their commitment to excellence and patient-centric approach truly sets them apart. I'm immensely grateful for their compassion and expertise.",3,"Fort Myers, Florida"
TESTIMONIAL,Benjamin Harris,"I can't thank the HelixDoc healthcare professionals enough for their dedication and expertise. Their compassionate care and attention to detail made a world of difference in my recovery journey. From diagnosis to treatment, every step was handled with precision and empathy. I'm beyond grateful for the exceptional healthcare I received.",4,"Melbourne, Florida"
TESTIMONIAL,Olivia Carter,"I've always been apprehensive about medical procedures, but the team at HelixDoc made me feel at ease right from the start. Their commitment to patient well-being is truly remarkable. They not only treated my condition effectively but also took the time to explain every aspect of the process, ensuring I felt informed and empowered throughout. Highly recommended!",5,"Miami, Florida"
